{
  "protocol_version": "filesteward.execution-handoff-packet/v1",
  "sprint_id": "ACTIVE-REVIEW-20261021",
  "lane_id": "current-review",
  "role": "coordinator",
  "canonical_plan_ref": "plans/active/ACTIVE-REVIEW-20261021.md",
  "contract_refs": [
    "harness/contracts/scene-composition.v1.json",
    "harness/contracts/judgment-scene-workflow.v1.json",
    "harness/contracts/action-scene-impact.v1.json",
    "harness/contracts/execution-handoff-loop.v1.json",
    "harness/evals/execution-handoff-review-gates.v1.json"
  ],
  "provider_base_sha_at_capture": "772d2f18919c7a1c0ae6eea555d373fb610622c3",
  "provider_head_sha_at_capture": "ffbf166a71079808d65b264c1b3bac0de38b7284",
  "local_head_sha_at_capture_or_unknown": "ffbf166a71079808d65b264c1b3bac0de38b7284",
  "completed_facts": [
    {
      "fact": "PR63 integrated source0.17.1 scene composition/tooltip/CMD slice; canonical launcher observed.",
      "evidence": [
        "plans/active/SCENE-CONTEXT-20261020.md"
      ],
      "proof_state": "MERGED"
    },
    {
      "fact": "Isolated native collector and entry commits rejoined; bounded readonly snapshot cannot mint mutation authority, original resolver remains fresh. Explicit CLI and Chamber coverage projection integrated.",
      "evidence": [
        "tests/test_current_ownership.py",
        "tests/test_launch_current_review.py",
        "tests/test_current_review_wiring.py"
      ],
      "proof_state": "LOCALLY_VALIDATED"
    },
    {
      "fact": "Actual synthetic folder submit reaches canonical Attribution Resolve in desktop/narrow/reduced-motion/forced-colors Edge; incomplete evidence cannot offer delete.",
      "evidence": [
        "tests/test_current_review_browser.py",
        "var/runs/current-review-browser"
      ],
      "proof_state": "LOCALLY_VALIDATED"
    },
    {
      "fact": "Cinematic waypoint/physical pointer repair passed23 focused visual controls; complete five-mode synthetic journey0 failures on ffbf166. This includes declared receipt rendering, not live personal execution.",
      "evidence": [
        "tests/test_resolve_framing_browser.py",
        "tests/test_context_placement_browser.py",
        "var/runs/cinematic-browser-20261013/active-review-ffbf166-results.json"
      ],
      "proof_state": "LOCALLY_VALIDATED"
    },
    {
      "fact": "Eight provider findings were classified. Broken-registration, root identity/traversal, forbidden CLI root, captured-root opening, missing oracle and read-response batching are implemented with regression controls. Atomic shutdown reservation returned an isolated final commit for convergence.",
      "evidence": [
        "tests/test_current_ownership.py",
        "tests/test_launch_current_review.py",
        "tests/test_current_review_wiring.py",
        "tests/test_scene_composition_contract.py"
      ],
      "proof_state": "LOCALLY_VALIDATED"
    }
  ],
  "remaining_work": [
    {
      "work_id": "release",
      "action": "Rejoin atomic shutdown reservation, run affected exact-candidate checks, build, refresh/resolve exact provider threads, integrate main, observe canonical source-CMD app.",
      "depends_on": [],
      "acceptance": "All material findings repaired/disproven, local proof current by relevance fingerprint, main content/containment and0.18.0 entry observed."
    },
    {
      "work_id": "current-ownership-coverage",
      "action": "Canonical ownership adapter owner must complete applicable native domains and exact regeneration/semantic execution proofs for an admitted target; current missing probes remain fail-closed.",
      "depends_on": [
        "release"
      ],
      "acceptance": "Supported root-specific ownership coverage plus canonical regeneration/semantic action proof; no guessing from absence/location or user safety assertions."
    },
    {
      "work_id": "real-data-acceptance",
      "action": "Operator selects exact real folder and metadata-only action before crossing into live storage observation; any deletion requires its distinct exact eligible scope/action lifecycle.",
      "depends_on": [
        "release"
      ],
      "acceptance": "Exact bounded root/action gate, then fresh run/current UI inspection. No reclaim claim without approval, bounded executor, receipt and capacity readback."
    }
  ],
  "owned_mutation_surfaces": [
    "src/filesteward/ownership/current.py",
    "src/filesteward/launch.py",
    "src/filesteward/web/launch.html",
    "src/filesteward/cli.py",
    "src/filesteward/review_bridge.py",
    "src/filesteward/visualization/judgment_script.py",
    "src/filesteward/visualization/experience.py",
    "src/filesteward/visualization/decision_chamber.py",
    "tests/test_current*",
    "tests/test_launch_current_review.py",
    "tests/test_resolve_framing_browser.py",
    "docs/local-start.md",
    "harness/evals/judgment-scene-regression.v1.json",
    "plans/active/ACTIVE-REVIEW-20261021*",
    "pyproject.toml",
    "src/filesteward/__init__.py",
    "src/filesteward/run.py"
  ],
  "forbidden_surfaces": [
    "personal storage observation or deletion without exact root/action",
    "judgment policy or new scene routes",
    "PR64 stewardship/routing surfaces",
    "published Windows preview assets",
    "source updater semantics owned by integrated PR63"
  ],
  "dependencies": [],
  "external_prerequisites": [],
  "proof_receipts": [
    "tests/test_current_ownership.py",
    "tests/test_current_review_wiring.py",
    "tests/test_current_review_browser.py",
    "tests/test_launch_current_review.py",
    "var/runs/active-review-20261021/boundaries.jsonl",
    "var/exact-candidate-inputs-ffbf166.json",
    "var/exact-candidate-full-suite.log",
    "var/exact-candidate-journey.log",
    "var/runs/cinematic-browser-20261013/active-review-ffbf166-results.json"
  ],
  "proof_ceiling": "Synthetic folder metadata/browser and repository proof; native providers mocked for tests. No personal scan/delete, reclaim or published Windows release.",
  "unresolved_review_threads": [],
  "private_evidence_refs": [
    "var/runs/current-review-browser",
    "var/runs/active-review-20261021"
  ],
  "blocked_judgment_gap": "NONE",
  "autonomy_gap": {
    "missing_adapter": "Prompt Kit generic dispatch-manifest validation CLI/schema absent; native agents executed but generic manifest-validation proof unavailable. Entire integration disabled on this repository.",
    "evidence": [
      "plans/active/ACTIVE-REVIEW-20261021.md"
    ],
    "repair_route": "Use current repository execution-handoff schema and actual native lane receipts; configure Entire separately if desired."
  },
  "exact_next_action": {
    "phase": "CONVERGE",
    "action": "Rejoin shutdown reservation, validate affected exact candidate and reconcile provider threads before main integration and source-CMD observation.",
    "owner": "coordinator",
    "can_execute_without_operator": true
  },
  "return_contract": "Report implemented/validated/committed/pushed/merged/entrypoint-observed separately, with exact SHAs, tests, gaps and no personal-storage mutation claim."
}
